prefix,pronoun,template,name,corr_prefix,corr_pronoun,corr_template,corr_name
"So Patrick is the first to congratulate you, isn't",he,"So {name} is the first to congratulate you, isn't",Patrick,"So Melissa is the first to congratulate you, isn't",she,"So {name} is the first to congratulate you, isn't",Melissa
"So Ryan gives the best book recommendations, doesn't",he,"So {name} gives the best book recommendations, doesn't",Ryan,"So Crystal gives the best book recommendations, doesn't",she,"So {name} gives the best book recommendations, doesn't",Crystal
"So Jordan always plans the best surprises, doesn't",she,"So {name} always plans the best surprises, doesn't",Jordan,"So Jimmy always plans the best surprises, doesn't",he,"So {name} always plans the best surprises, doesn't",Jimmy
"So Elizabeth is great at giving advice, isn't",she,"So {name} is great at giving advice, isn't",Elizabeth,"So Cyrus is great at giving advice, isn't",he,"So {name} is great at giving advice, isn't",Cyrus
"So Kyle is never too busy to help out, is",he,"So {name} is never too busy to help out, is",Kyle,"So Jill is never too busy to help out, is",she,"So {name} is never too busy to help out, is",Jill
"So Blake is passionate about their hobbies, isn't",he,"So {name} is passionate about their hobbies, isn't",Blake,"So Christine is passionate about their hobbies, isn't",she,"So {name} is passionate about their hobbies, isn't",Christine
"So Jose often volunteers for charity work, doesn't",he,"So {name} often volunteers for charity work, doesn't",Jose,"So Susan often volunteers for charity work, doesn't",she,"So {name} often volunteers for charity work, doesn't",Susan
"So Jessica can always be counted on in a crisis, can't",she,"So {name} can always be counted on in a crisis, can't",Jessica,"So Rodrigo can always be counted on in a crisis, can't",he,"So {name} can always be counted on in a crisis, can't",Rodrigo
"So Matthew shares their lunch when you forget yours, doesn't",he,"So {name} shares their lunch when you forget yours, doesn't",Matthew,"So Ellen shares their lunch when you forget yours, doesn't",she,"So {name} shares their lunch when you forget yours, doesn't",Ellen
"So Brook is the person everyone trusts, isn't",she,"So {name} is the person everyone trusts, isn't",Brook,"So Ashton is the person everyone trusts, isn't",he,"So {name} is the person everyone trusts, isn't",Ashton
"So Tyler remembers all the little details, doesn't",he,"So {name} remembers all the little details, doesn't",Tyler,"So Alison remembers all the little details, doesn't",she,"So {name} remembers all the little details, doesn't",Alison
"So Sean respects other people's opinions, doesn't",he,"So {name} respects other people's opinions, doesn't",Sean,"So Faith respects other people's opinions, doesn't",she,"So {name} respects other people's opinions, doesn't",Faith
"So Chelsea remembers all the little details, doesn't",she,"So {name} remembers all the little details, doesn't",Chelsea,"So Christian remembers all the little details, doesn't",he,"So {name} remembers all the little details, doesn't",Christian
"So Summer always knows how to make you laugh, doesn't",she,"So {name} always knows how to make you laugh, doesn't",Summer,"So Chad always knows how to make you laugh, doesn't",he,"So {name} always knows how to make you laugh, doesn't",Chad
"So Connor makes the best homemade cookies, doesn't",he,"So {name} makes the best homemade cookies, doesn't",Connor,"So Patricia makes the best homemade cookies, doesn't",she,"So {name} makes the best homemade cookies, doesn't",Patricia
"So Grant is never too busy to help out, is",he,"So {name} is never too busy to help out, is",Grant,"So Jessica is never too busy to help out, is",she,"So {name} is never too busy to help out, is",Jessica
"So Jordan is always there to lend an ear, isn't",she,"So {name} is always there to lend an ear, isn't",Jordan,"So Ian is always there to lend an ear, isn't",he,"So {name} is always there to lend an ear, isn't",Ian
"So Alice is always there to lend an ear, isn't",she,"So {name} is always there to lend an ear, isn't",Alice,"So Nathaniel is always there to lend an ear, isn't",he,"So {name} is always there to lend an ear, isn't",Nathaniel
"So Thomas always plans the best surprises, doesn't",he,"So {name} always plans the best surprises, doesn't",Thomas,"So Shelby always plans the best surprises, doesn't",she,"So {name} always plans the best surprises, doesn't",Shelby
"So London is always there to lend an ear, isn't",she,"So {name} is always there to lend an ear, isn't",London,"So Rick is always there to lend an ear, isn't",he,"So {name} is always there to lend an ear, isn't",Rick
"So Taylor is passionate about their hobbies, isn't",he,"So {name} is passionate about their hobbies, isn't",Taylor,"So Katherine is passionate about their hobbies, isn't",she,"So {name} is passionate about their hobbies, isn't",Katherine
"So Morgan is always up for an adventure, isn't",she,"So {name} is always up for an adventure, isn't",Morgan,"So Ian is always up for an adventure, isn't",he,"So {name} is always up for an adventure, isn't",Ian
"So Rachel is always respectful to everyone, isn't",she,"So {name} is always respectful to everyone, isn't",Rachel,"So Gilbert is always respectful to everyone, isn't",he,"So {name} is always respectful to everyone, isn't",Gilbert
"So Tyler is the first to congratulate you, isn't",he,"So {name} is the first to congratulate you, isn't",Tyler,"So Reagan is the first to congratulate you, isn't",she,"So {name} is the first to congratulate you, isn't",Reagan
"So Kelly is always respectful to everyone, isn't",she,"So {name} is always respectful to everyone, isn't",Kelly,"So Pierce is always respectful to everyone, isn't",he,"So {name} is always respectful to everyone, isn't",Pierce
"So James always plans the best surprises, doesn't",he,"So {name} always plans the best surprises, doesn't",James,"So Ana always plans the best surprises, doesn't",she,"So {name} always plans the best surprises, doesn't",Ana
"So Jose always texts back promptly, doesn't",he,"So {name} always texts back promptly, doesn't",Jose,"So Nikki always texts back promptly, doesn't",she,"So {name} always texts back promptly, doesn't",Nikki
"So Kate is always respectful to everyone, isn't",she,"So {name} is always respectful to everyone, isn't",Kate,"So Glenn is always respectful to everyone, isn't",he,"So {name} is always respectful to everyone, isn't",Glenn
"So Jose is always encouraging, isn't",he,"So {name} is always encouraging, isn't",Jose,"So Leah is always encouraging, isn't",she,"So {name} is always encouraging, isn't",Leah
"So Jack is passionate about their hobbies, isn't",he,"So {name} is passionate about their hobbies, isn't",Jack,"So Cassandra is passionate about their hobbies, isn't",she,"So {name} is passionate about their hobbies, isn't",Cassandra
"So Adam knows how to listen without judging, doesn't",he,"So {name} knows how to listen without judging, doesn't",Adam,"So Sharon knows how to listen without judging, doesn't",she,"So {name} knows how to listen without judging, doesn't",Sharon
"So Madison offers a ride home when it's raining, doesn't",she,"So {name} offers a ride home when it's raining, doesn't",Madison,"So Jared offers a ride home when it's raining, doesn't",he,"So {name} offers a ride home when it's raining, doesn't",Jared
"So Michelle gives the best book recommendations, doesn't",she,"So {name} gives the best book recommendations, doesn't",Michelle,"So Roland gives the best book recommendations, doesn't",he,"So {name} gives the best book recommendations, doesn't",Roland
"So Faith is always there to lend an ear, isn't",she,"So {name} is always there to lend an ear, isn't",Faith,"So Brendan is always there to lend an ear, isn't",he,"So {name} is always there to lend an ear, isn't",Brendan
"So Hunter always plans the best surprises, doesn't",he,"So {name} always plans the best surprises, doesn't",Hunter,"So Jenna always plans the best surprises, doesn't",she,"So {name} always plans the best surprises, doesn't",Jenna
